{
  "$schema": "https://json-schema.org/draft/2020-12/schema",
  "$id": "https://digiwiz.local/contracts/source-resolution/context_assembly.schema.json",
  "title": "Context Assembly Pipeline",
  "description": "ADR-0011 — Internes Context-Array vor Antwortgenerierung. Kein Auto-Publish.",
  "type": "object",
  "required": [
    "assembly_id",
    "query",
    "answer_goal",
    "answer_structure",
    "required_fields",
    "context_array",
    "resolution_stages",
    "ready_for_generation",
    "missing_mandatory_fields",
    "canonical_sequence_ref",
    "classification"
  ],
  "properties": {
    "assembly_id": { "type": "string" },
    "decision_id": {
      "type": "string",
      "description": "ADR-0014 — Korrelation zur Decision Engine (Pflicht wenn Decision-Pfad genutzt)"
    },
    "decision_context_ref": {
      "type": "string",
      "description": "Verweis auf decision_context (decision_id oder Artefaktpfad)"
    },
    "source_requirements_planned": {
      "$ref": "../decision-engine/decision_shared.schema.json#/$defs/source_requirements",
      "description": "Geplante Quellen aus Decision Engine — Abgleich mit tatsächlicher Feldfüllung"
    },
    "canonical_sequence_ref": {
      "type": "string",
      "const": "contracts/source-resolution/source_resolution_policy.yaml",
      "description": "Verweis auf kanonische Source-Resolution-Sequenz (ADR-0013)"
    },
    "classification": {
      "type": "object",
      "required": ["sql_first", "steps_completed"],
      "properties": {
        "sql_first": { "type": "boolean" },
        "steps_completed": {
          "type": "array",
          "items": {
            "enum": [
              "classify_intent",
              "kp_governance",
              "sql_crm_stammdaten",
              "knowledge_graph",
              "chroma_rag",
              "web_external"
            ]
          },
          "minItems": 2,
          "uniqueItems": true,
          "description": "Kanonische Schritte aus source_resolution_policy.yaml — classify_intent und kp_governance Pflicht"
        }
      }
    },
    "query": { "type": "string", "minLength": 1 },
    "task": { "type": "string" },
    "answer_goal": { "type": "string", "minLength": 1 },
    "answer_structure": {
      "type": "array",
      "items": { "type": "string" },
      "minItems": 1,
      "description": "Geordnete Abschnitte der geplanten Antwort"
    },
    "required_fields": {
      "type": "array",
      "items": {
        "allOf": [
          { "$ref": "../decision-engine/decision_shared.schema.json#/$defs/required_field" },
          { "required": ["label"] }
        ]
      },
      "minItems": 1
    },
    "context_array": {
      "type": "array",
      "items": {
        "type": "object",
        "required": ["field_id", "status"],
        "properties": {
          "field_id": { "type": "string" },
          "status": {
            "enum": ["filled", "missing", "uncertain", "conflict"]
          },
          "value": { "type": ["string", "null"] },
          "source_layer": {
            "enum": [
              "sql_crm",
              "knowledge_platform",
              "knowledge_graph",
              "chroma_rag",
              "web_external",
              "none"
            ]
          },
          "source_ref": { "type": "string" },
          "confidence": { "type": "number", "minimum": 0, "maximum": 1 },
          "provenance": { "type": "object" }
        }
      }
    },
    "resolution_stages": {
      "type": "array",
      "items": {
        "enum": [
          "analyze_query",
          "define_answer_structure",
          "derive_required_fields",
          "query_sql_crm",
          "query_knowledge_platform",
          "query_knowledge_graph",
          "query_chroma_rag",
          "query_web_external",
          "mark_conflicts",
          "validate_mandatory_fields"
        ]
      },
      "description": "Tatsächlich durchlaufene Pipeline-Schritte"
    },
    "source_query_log": {
      "type": "array",
      "items": {
        "type": "object",
        "required": ["stage", "triggered_by_field_ids"],
        "properties": {
          "stage": { "type": "string" },
          "triggered_by_field_ids": {
            "type": "array",
            "items": { "type": "string" }
          },
          "fields_resolved": {
            "type": "array",
            "items": { "type": "string" }
          }
        }
      }
    },
    "conflicts": {
      "type": "array",
      "items": {
        "type": "object",
        "required": ["field_id", "sources", "resolution", "winner"],
        "properties": {
          "field_id": { "type": "string" },
          "sources": { "type": "array", "items": { "type": "string" } },
          "resolution": { "type": "string" },
          "winner": { "type": "string" }
        }
      }
    },
    "missing_mandatory_fields": {
      "type": "array",
      "items": { "type": "string" }
    },
    "ready_for_generation": {
      "type": "boolean",
      "description": "true nur wenn alle mandatory fields filled oder bewusst als missing dokumentiert"
    },
    "uncertainties": {
      "type": "array",
      "items": { "type": "string" }
    },
    "applied_playbooks": { "type": "array", "items": { "type": "string" } },
    "applied_adrs": { "type": "array", "items": { "type": "string" } }
  },
  "not": {
    "required": ["published_url", "auto_publish"]
  },
  "allOf": [
    {
      "properties": {
        "classification": {
          "properties": {
            "steps_completed": {
              "contains": { "enum": ["classify_intent"] }
            }
          }
        }
      }
    },
    {
      "properties": {
        "classification": {
          "properties": {
            "steps_completed": {
              "contains": { "enum": ["kp_governance"] }
            }
          }
        }
      }
    },
    {
      "if": {
        "properties": { "ready_for_generation": { "const": true } },
        "required": ["ready_for_generation"]
      },
      "then": {
        "properties": {
          "missing_mandatory_fields": { "maxItems": 0 }
        }
      }
    }
  ]
}
